{
  "$schema": "../schema/summary.schema.json",
  "schema_version": 1,
  "run_id": "20260608_083454",
  "captured_at": "2026-06-08T08:34:54",
  "git": {
    "commit_sha": "migrated-legacy",
    "branch": "migrated-legacy",
    "dirty": false
  },
  "machine": {
    "platform": "legacy-e2e",
    "machine": "migrated",
    "processor": "benchmark_logs-import"
  },
  "env_flags": {
    "odbc_e2e_dml_perf_row_count": 100,
    "odbc_e2e_dml_bulk_row_count": 50000,
    "odbc_e2e_dml_bulk_chunk_size": 1000,
    "odbc_pool_size": 8,
    "method": "odbc_fast.bulkInsert",
    "odbc_test_dsn_configured": true
  },
  "suites": [
    {
      "id": "odbc_dml_perf_live_e2e.sqlAnywhere",
      "kind": "flutter_test",
      "status": "pass",
      "metrics": {
        "rows": 100.0,
        "wall_ms": 2448.0
      },
      "wall_ms": 2448.0
    },
    {
      "id": "odbc_dml_perf_live_e2e.sqlServer",
      "kind": "flutter_test",
      "status": "pass",
      "metrics": {
        "rows": 100.0,
        "wall_ms": 2502.0
      },
      "wall_ms": 2502.0
    },
    {
      "id": "odbc_dml_bulk_load_live_e2e.sqlAnywhere",
      "kind": "flutter_test",
      "status": "pass",
      "metrics": {
        "rows": 50000.0,
        "create_ms": 34.0,
        "insert_ms": 1160.0,
        "bulk_insert_parallel_total": 0.0,
        "bulk_insert_chunked_total": 1.0,
        "update_ms": 77.0,
        "delete_ms": 1654.0,
        "drop_ms": 60.0,
        "insert_rows_per_sec": 43103.45,
        "update_rows_per_sec": 649350.65,
        "delete_rows_per_sec": 30229.75,
        "wall_ms": 2985.0
      },
      "wall_ms": 2985.0
    },
    {
      "id": "odbc_dml_bulk_load_live_e2e.sqlServer",
      "kind": "flutter_test",
      "status": "pass",
      "metrics": {
        "rows": 50000.0,
        "create_ms": 21.0,
        "insert_ms": 2684.0,
        "bulk_insert_parallel_total": 1.0,
        "bulk_insert_chunked_total": 1.0,
        "update_ms": 66.0,
        "delete_ms": 78.0,
        "drop_ms": 29.0,
        "insert_rows_per_sec": 18628.91,
        "update_rows_per_sec": 757575.76,
        "delete_rows_per_sec": 641025.64,
        "wall_ms": 2878.0
      },
      "wall_ms": 2878.0
    },
    {
      "id": "sql_queue_burst_test.sqlAnywhere",
      "kind": "flutter_test",
      "status": "pass",
      "metrics": {
        "wall_ms": 15000.0
      },
      "wall_ms": 15000.0
    },
    {
      "id": "sql_queue_burst_test.sqlServer",
      "kind": "flutter_test",
      "status": "pass",
      "metrics": {
        "wall_ms": 5000.0
      },
      "wall_ms": 5000.0
    },
    {
      "id": "hub_socket_live_e2e.hub",
      "kind": "flutter_test",
      "status": "skipped",
      "reason": "E2E_HUB_TOKEN JWT expired"
    },
    {
      "id": "hub_agent_action_rpc_live_e2e.hub",
      "kind": "flutter_test",
      "status": "skipped",
      "reason": "E2E_HUB_TOKEN JWT expired"
    },
    {
      "id": "auto_update_diagnostics_push_e2e.hub",
      "kind": "flutter_test",
      "status": "fail",
      "reason": "throttle window: second push was not suppressed"
    },
    {
      "id": "sqlAnywhere",
      "kind": "flutter_test",
      "status": "pass",
      "metrics": {
        "passed": 32.0,
        "skipped": 10.0,
        "failed": 0.0,
        "wall_ms": 30075.0
      },
      "wall_ms": 30075.0
    },
    {
      "id": "sqlServer",
      "kind": "flutter_test",
      "status": "fail",
      "metrics": {
        "passed": 32.0,
        "skipped": 9.0,
        "failed": 1.0,
        "wall_ms": 15914.0
      },
      "wall_ms": 15914.0,
      "reason": "test/live/auto_update_diagnostics_push_e2e_test.dart (hub throttle: expected 1 push, got 2)"
    }
  ],
  "notes": [
    "Migrated from legacy benchmark_logs/ E2E summary (schema v1).",
    "Connection strings, URLs, tokens and host-specific config were stripped.",
    "Source: D:/Developer/plug_database/plug_agente/benchmark_logs/20260608_083454/summary.json"
  ]
}
