{
  "$schema": "../schema/summary.schema.json",
  "schema_version": 1,
  "run_id": "20260606_115942",
  "captured_at": "2026-06-06T11:59:42",
  "git": {
    "commit_sha": "migrated-legacy",
    "branch": "migrated-legacy",
    "dirty": false
  },
  "machine": {
    "platform": "legacy-e2e",
    "machine": "migrated",
    "processor": "benchmark_logs-import"
  },
  "env_flags": {
    "odbc_pool_size": 8,
    "odbc_e2e_dml_perf_row_count": 100,
    "odbc_e2e_dml_bulk_row_count": 50000,
    "odbc_test_dsn_configured": true
  },
  "suites": [
    {
      "id": "odbc_dml_perf_live_e2e.sqlAnywhere",
      "kind": "flutter_test",
      "status": "pass",
      "metrics": {
        "wall_ms": 2000.0
      },
      "wall_ms": 2000.0
    },
    {
      "id": "odbc_dml_perf_live_e2e.sqlServer",
      "kind": "flutter_test",
      "status": "pass",
      "metrics": {
        "wall_ms": 2000.0
      },
      "wall_ms": 2000.0
    },
    {
      "id": "odbc_dml_stress_live_e2e.sqlAnywhere",
      "kind": "flutter_test",
      "status": "pass",
      "metrics": {
        "insert_ms": 1301.0,
        "update_ms": 61.0,
        "delete_ms": 58.0,
        "total_ms": 1494.0,
        "queued_elapsed_ms": 1282.0,
        "rows": 100.0,
        "concurrency": 8.0
      }
    },
    {
      "id": "odbc_dml_stress_live_e2e.sqlServer",
      "kind": "flutter_test",
      "status": "pass",
      "metrics": {
        "insert_ms": 1269.0,
        "update_ms": 63.0,
        "delete_ms": 58.0,
        "total_ms": 1472.0,
        "queued_elapsed_ms": 1309.0,
        "rows": 100.0,
        "concurrency": 8.0
      }
    },
    {
      "id": "odbc_dml_bulk_load_live_e2e.sqlAnywhere",
      "kind": "flutter_test",
      "status": "pass",
      "metrics": {
        "create_ms": 23.0,
        "insert_ms": 796.0,
        "bulk_insert_parallel_total": 0.0,
        "bulk_insert_chunked_total": 1.0,
        "update_ms": 52.0,
        "delete_ms": 1461.0,
        "drop_ms": 52.0,
        "rows": 50000.0
      }
    },
    {
      "id": "odbc_dml_bulk_load_live_e2e.sqlServer",
      "kind": "flutter_test",
      "status": "pass",
      "metrics": {
        "create_ms": 15.0,
        "insert_ms": 2296.0,
        "bulk_insert_parallel_total": 1.0,
        "bulk_insert_chunked_total": 1.0,
        "update_ms": 50.0,
        "delete_ms": 51.0,
        "drop_ms": 11.0,
        "rows": 50000.0
      }
    },
    {
      "id": "odbc_rpc_execute_coverage_live_e2e.sqlAnywhere",
      "kind": "flutter_test",
      "status": "pass",
      "metrics": {
        "skipped": 1.0
      }
    },
    {
      "id": "odbc_rpc_execute_coverage_live_e2e.sqlServer",
      "kind": "flutter_test",
      "status": "pass",
      "metrics": {
        "skipped": 1.0
      }
    },
    {
      "id": "odbc_streaming_live_integration.sqlAnywhere",
      "kind": "flutter_test",
      "status": "pass"
    },
    {
      "id": "odbc_streaming_live_integration.sqlAnywhere",
      "kind": "flutter_test",
      "status": "pass"
    },
    {
      "id": "odbc_queued_gateway_smoke_live_e2e.sqlAnywhere",
      "kind": "flutter_test",
      "status": "pass"
    },
    {
      "id": "odbc_queued_gateway_smoke_live_e2e.sqlServer",
      "kind": "flutter_test",
      "status": "pass"
    },
    {
      "id": "odbc_lock_contention_live_integration.sqlAnywhere",
      "kind": "flutter_test",
      "status": "pass"
    },
    {
      "id": "odbc_lock_contention_live_integration.sqlServer",
      "kind": "flutter_test",
      "status": "pass"
    },
    {
      "id": "sql_queue_burst_test.sqlAnywhere",
      "kind": "flutter_test",
      "status": "pass",
      "metrics": {
        "wall_ms": 20000.0
      },
      "wall_ms": 20000.0
    },
    {
      "id": "sql_queue_burst_test.sqlServer",
      "kind": "flutter_test",
      "status": "pass",
      "metrics": {
        "wall_ms": 6000.0
      },
      "wall_ms": 6000.0
    },
    {
      "id": "odbc_sql_anywhere_top_start_at_live.sqlAnywhere",
      "kind": "flutter_test",
      "status": "pass"
    },
    {
      "id": "hub_socket_live_e2e.hub",
      "kind": "flutter_test",
      "status": "skipped",
      "reason": "E2E_HUB_TOKEN JWT expired"
    },
    {
      "id": "hub_agent_action_rpc_live_e2e.hub",
      "kind": "flutter_test",
      "status": "skipped",
      "reason": "E2E_HUB_TOKEN JWT expired"
    }
  ],
  "notes": [
    "Migrated from legacy benchmark_logs/ E2E summary (schema v1).",
    "Connection strings, URLs, tokens and host-specific config were stripped.",
    "Source: D:/Developer/plug_database/plug_agente/benchmark_logs/20260606_115942/summary.json"
  ]
}
