{
  "$schema": "../schema/summary.schema.json",
  "schema_version": 1,
  "run_id": "20260615_160631",
  "captured_at": "2026-06-15T16:06:39-04:00",
  "git": {
    "commit_sha": "a625d39645d1f068ad6ed91278fb4de3e7c07185",
    "branch": "main",
    "dirty": true
  },
  "machine": {
    "platform": "Windows-11-10.0.26200-SP0",
    "machine": "AMD64",
    "processor": "Intel64 Family 6 Model 170 Stepping 4, GenuineIntel",
    "python_version": "3.13.14"
  },
  "env_flags": {
    "odbc_test_dsn_configured": true,
    "odbc_driver_family": "SQL Server",
    "odbc_pool_size": 20,
    "odbc_async_worker_count": 32,
    "odbc_async_max_pending_requests": 128,
    "run_live_api_tests": true
  },
  "suites": [
    {
      "id": "odbc_async",
      "kind": "dart_odbc_fast",
      "status": "pass",
      "wall_ms": 5316.54,
      "exit_code": 0,
      "log_file": "odbc_async.log",
      "metrics": {
        "wall_ms": 5316.536299942527
      }
    },
    {
      "id": "odbc_streaming",
      "kind": "dart_odbc_fast",
      "status": "pass",
      "wall_ms": 1983.42,
      "exit_code": 0,
      "log_file": "odbc_streaming.log",
      "metrics": {
        "wall_ms": 1983.4172999835573
      }
    }
  ],
  "notes": [
    "Ephemeral run output; compare against benchmarks/baseline/summary.json.",
    "Legacy benchmark_logs/ format is not schema-compatible with this summary."
  ]
}
