{
  "$schema": "../schema/summary.schema.json",
  "schema_version": 1,
  "run_id": "20260606_122558",
  "captured_at": "2026-06-06T12:25:58",
  "git": {
    "commit_sha": "migrated-legacy",
    "branch": "migrated-legacy",
    "dirty": false
  },
  "machine": {
    "platform": "legacy-e2e",
    "machine": "migrated",
    "processor": "benchmark_logs-import"
  },
  "env_flags": {
    "odbc_e2e_dml_bulk_tests": true,
    "odbc_e2e_dml_bulk_row_count": 50000,
    "odbc_e2e_dml_bulk_chunk_size": 1000,
    "odbc_pool_size": 8,
    "method": "odbc_fast.bulkInsert",
    "odbc_test_dsn_configured": true
  },
  "suites": [
    {
      "id": "odbc_dml_bulk_load_live_e2e.sqlAnywhere",
      "kind": "flutter_test",
      "status": "pass",
      "metrics": {
        "rows": 50000.0,
        "create_ms": 35.0,
        "insert_ms": 878.0,
        "bulk_insert_parallel_total": 0.0,
        "bulk_insert_chunked_total": 1.0,
        "update_ms": 74.0,
        "delete_ms": 1758.0,
        "drop_ms": 63.0,
        "insert_rows_per_sec": 56947.61,
        "update_rows_per_sec": 675675.68,
        "delete_rows_per_sec": 28441.41,
        "wall_ms": 7239.0
      },
      "wall_ms": 7239.0
    },
    {
      "id": "odbc_dml_bulk_load_live_e2e.sqlServer",
      "kind": "flutter_test",
      "status": "pass",
      "metrics": {
        "rows": 50000.0,
        "create_ms": 15.0,
        "insert_ms": 1890.0,
        "bulk_insert_parallel_total": 1.0,
        "bulk_insert_chunked_total": 1.0,
        "update_ms": 33.0,
        "delete_ms": 50.0,
        "drop_ms": 10.0,
        "insert_rows_per_sec": 26455.03,
        "update_rows_per_sec": 1515151.52,
        "delete_rows_per_sec": 1000000.0,
        "wall_ms": 6287.0
      },
      "wall_ms": 6287.0
    }
  ],
  "notes": [
    "Migrated from legacy benchmark_logs/ E2E summary (schema v1).",
    "Connection strings, URLs, tokens and host-specific config were stripped.",
    "Source: D:/Developer/plug_database/plug_agente/benchmark_logs/20260606_122558/summary.json"
  ]
}
